{
  "$schema": "https://json-schema.org/draft/2020-12/schema",
  "$id": "https://relationality.local/schemas/object.schema.json",
  "title": "Recognition Object",
  "description": "Frozen recognition-carrier derived directly from acts. Objects are immutable and only loaded at boot.",
  "type": "object",
  "required": ["id", "kind", "payload"],
  "properties": {
    "id": {
      "type": "string",
      "pattern": "^[A-Za-z0-9_.:-]+$",
      "description": "Stable identifier for the object within the persistent layer."
    },
    "kind": {
      "type": "string",
      "description": "Recognition kind (e.g., ProfileTopos, PhaseSpace, MeasurementFrame, Trace, FixedInvariant, ObservationCarrier)."
    },
    "acts": {
      "type": "array",
      "description": "Act-level recognitions that generate this carrier.",
      "items": {"type": "string"}
    },
    "payload": {
      "type": "object",
      "description": "Finite recognition lattice fragment and contextual data carried by this object.",
      "properties": {
        "recognition_lattice": {"type": "object"},
        "context": {"type": "object"},
        "trace": {"type": "object"},
        "profile": {"type": "object"},
        "phase_space": {"type": "object"},
        "measurement": {"type": "object"},
        "fixed_invariants": {"type": "object"}
      },
      "additionalProperties": true
    },
    "metadata": {
      "type": "object",
      "description": "Auxiliary information such as provenance or diagnostics seeded by acts.",
      "additionalProperties": true
    }
  },
  "additionalProperties": false
}
