{
  "id": "fixed-invariants:default",
  "kind": "FixedInvariants",
  "acts": ["FixFlow", "FixNucleus", "FixFlowNucleus", "FixedInvariant"],
  "payload": {
    "fixed_invariants": {
      "stable_modes": []
    },
    "recognition_lattice": {
      "description": "Fixed invariant carriers derived from fixed-point acts."
    }
  },
  "metadata": {
    "frozen": true
  }
}
