{
  "id": "profile-topos:default",
  "kind": "ProfileTopos",
  "acts": ["ProfileTopos", "ProfileSemantics", "RecognizeContext"],
  "payload": {
    "recognition_lattice": {
      "description": "Seed ProfileTopos recognitions derived from acts for profile logic."
    },
    "context": {
      "classifiers": ["Recognition", "ContextGeometry"],
      "internal_limits": ["finite"],
      "profile_semantics": {
        "notes": "Derived directly from acts describing ProfileTopos and ProfileSemantics."
      }
    }
  },
  "metadata": {
    "frozen": true
  }
}
