{
  "id": "measurement-frame:default",
  "kind": "MeasurementFrame",
  "acts": ["MeasurementFrame", "RecognizeObservation", "ProfileObserve", "WitnessObservation"],
  "payload": {
    "measurement": {
      "channels": ["default"],
      "observation_kernel": "ObservationKernel",
      "compatibility": "profile-bound"
    },
    "recognition_lattice": {
      "description": "Observation recognitions constrained by ProfileObserve."
    }
  },
  "metadata": {
    "frozen": true
  }
}
