{
  "id": "phase-space:spectral",
  "kind": "PhaseSpace",
  "acts": ["PhaseSpace", "ProfileDynamics", "FlowProfile", "Spectrum"],
  "payload": {
    "phase_space": {
      "state": "spectral",
      "reachable": [1.0, 0.5, 0.25],
      "invariants": [],
      "adjacency": [
        [0, 1, 0],
        [1, 0, 1],
        [0, 1, 0]
      ]
    },
    "recognition_lattice": {
      "description": "Spectral phase-space carrier with adjacency for Laplacian."
    }
  },
  "metadata": {
    "frozen": true
  }
}
